bookID,average_rating,ratings_count,summary
13,4.35,305740,"At last in paperback in one complete volume, here are the five novels from Douglas Adams's Hitchhiker series. ""The Hitchhiker's Guide to the Galaxy""Seconds before the Earth is demolished for a galactic freeway, Arthur Dent is saved by Ford Prefect, a researcher for the revised Guide. Together they stick out their thumbs to the stars and begin a wild journey through time and space.""The Restaurant at the End of the Universe""Facing annihilation at the hands of warmongers is a curious time to crave tea. It could only happen to the cosmically displaced Arthur Dent and his comrades as they hurtle across the galaxy in a desperate search for a place to eat.""Life, the Universe and Everything""The unhappy inhabitants of planet Krikkit are sick of looking at the night sky- so they plan to destroy it. The universe, that is. Now only five individuals can avert Armageddon: mild-mannered Arthur Dent and his stalwart crew.""So Long, and Thanks for All the Fish""Back on Earth, Arthur Dent is ready to believe that the past eight years were all just a figment of his stressed-out imagination. But a gift-wrapped fishbowl with a cryptic inscription conspires to thrust him back to reality. So to speak.""Mostly Harmless""Just when Arthur Dent makes the terrible mistake of starting to enjoy life, all hell breaks loose. Can he save the Earth from total obliteration? Can he save the Guide from a hostile alien takeover? Can he save his daughter from herself?Also includes the short story ""Young Zaphod Plays It Safe""."
34,4.37,2509628,"Alternate Cover Edition ISBN 0618260269 (copyright page ISBN is 0618346252 - different from back cover)One Ring to rule them all, One Ring to find them, One Ring to bring them all and in the darkeness bind themIn ancient times the Rings of Power were crafted by the Elven-smiths, and Sauron, The Dark Lord, forged the One Ring, filling it with his own power so that he could rule all others. But the One Ring was taken from him, and though he sought it throughout Middle-earth, it remained lost to him. After many ages it fell into the hands of Bilbo Baggins, as told in The Hobbit.In a sleepy village in the Shire, young Frodo Baggins finds himself faced with an immense task, as his elderly cousin Bilbo entrusts the Ring to his care. Frodo must leave his home and make a perilous journey across Middle-earth to the Cracks of Doom, there to destroy the Ring and foil the Dark Lord in his evil purpose.--back cover"
40,3.61,1595,"Gerald Samper, an effete English snob, has his own private hilltop in Tuscany, where he whiles away his time working as a ghostwriter for celebrities and inventing wholly original culinary concoctions — including ice cream made with garlic and the bitter, herb-based liqueur of the book's title. Gerald's idyll is shattered by the arrival of Marta, on the run from a crime-riddled former soviet republic. A series of hilarious misunderstandings brings this odd couple into ever closer and more disastrous proximity.James Hamilton-Paterson's first novel, ""Gerontius,"" won the Whitbread Award. He is an acclaimed author of nonfiction books, including ""Seven-Tenths,"" ""Three Miles Down,"" and ""Playing with Water,"" He currently lives in Italy."
2,4.5,2780791,"There is a door at the end of a silent corridor. And it’s haunting Harry Pottter’s dreams. Why else would he be waking in the middle of the night, screaming in terror?Harry has a lot on his mind for this, his fifth year at Hogwarts: a Defense Against the Dark Arts teacher with a personality like poisoned honey; a big surprise on the Gryffindor Quidditch team; and the looming terror of the Ordinary Wizarding Level exams. But all these things pale next to the growing threat of He-Who-Must-Not-Be-Named - a threat that neither the magical government nor the authorities at Hogwarts can stop.As the grasp of darkness tightens, Harry must discover the true depth and strength of his friends, the importance of boundless loyalty, and the shocking price of unbearable sacrifice.His fate depends on them all."
3,4.47,7933132,"Harry Potter's life is miserable. His parents are dead and he's stuck with his heartless relatives, who force him to live in a tiny closet under the stairs. But his fortune changes when he receives a letter that tells him the truth about himself: he's a wizard. A mysterious visitor rescues him from his relatives and takes him to his new home, Hogwarts School of Witchcraft and Wizardry.After a lifetime of bottling up his magical powers, Harry finally feels like a normal kid. But even within the Wizarding community, he is special. He is the boy who lived: the only person to have ever survived a killing curse inflicted by the evil Lord Voldemort, who launched a brutal takeover of the Wizarding world, only to vanish after failing to kill Harry.Though Harry's first year at Hogwarts is the best of his life, not everything is perfect. There is a dangerous secret object hidden within the castle walls, and Harry believes it's his responsibility to prevent it from falling into evil hands. But doing so will bring him into contact with forces more terrifying than he ever could have imagined.Full of sympathetic characters, wildly imaginative situations, and countless exciting details, the first installment in the series assembles an unforgettable magical world and sets the stage for many high-stakes adventures to come."
4,4.43,3063433,"The Dursleys were so mean and hideous that summer that all Harry Potter wanted was to get back to the Hogwarts School for Witchcraft and Wizardry. But just as he's packing his bags, Harry receives a warning from a strange, impish creature named Dobby who says that if Harry Potter returns to Hogwarts, disaster will strike.And strike it does. For in Harry's second year at Hogwarts, fresh torments and horrors arise, including an outrageously stuck-up new professor, Gilderoy Lockhart, a spirit named Moaning Myrtle who haunts the girls' bathroom, and the unwanted attentions of Ron Weasley's younger sister, Ginny. But each of these seem minor annoyances when the real trouble begins, and someone, or something, starts turning Hogwarts students to stone. Could it be Draco Malfoy, a more poisonous rival than ever? Could it possibly be Hagrid, whose mysterious past is finally told? Or could it be the one everyone at Hogwarts most suspects: Harry Potter himself?"
5,4.57,3192100,"For twelve long years, the dread fortress of Azkaban held an infamous prisoner named Sirius Black. Convicted of killing thirteen people with a single curse, he was said to be the heir apparent to the Dark Lord, Voldemort.Now he has escaped, leaving only two clues as to where he might be headed: Harry Potter's defeat of You-Know-Who was Black's downfall as well. And the Azkaban guards heard Black muttering in his sleep, ""He's at Hogwarts . . . he's at Hogwarts.""Harry Potter isn't safe, not even within the walls of his magical school, surrounded by his friends. Because on top of it all, there may well be a traitor in their midst."
6,4.56,2885578,"Harry Potter is midway through his training as a wizard and his coming of age. Harry wants to get away from the pernicious Dursleys and go to the International Quidditch Cup with Hermione, Ron, and the Weasleys. He wants to dream about Cho Chang, his crush (and maybe do more than dream). He wants to find out about the mysterious event that's supposed to take place at Hogwarts this year, an event involving two other rival schools of magic, and a competition that hasn't happened for hundreds of years. He wants to be a normal, fourteen-year-old wizard. But unfortunately for Harry Potter, he's not normal - even by wizarding standards.And in his case, different can be deadly."
7,4.73,31572,"Six years of magic, adventure, and mystery make this paperback collection the perfect gift for Harry Potter fans of all ages.Follow Harry from his first days at Hogwarts School for Witchcraft and Wizardry, through his many adventures with Hermione and Ron, to his confrontations with rival Draco Malfoy and the dreaded Professor Snape. From a dangerous descent into the Chamber of Secrets to the Triwizard Tournament to the return of He-Who-Must-Not-Be-Named, each adventure is more riveting and exhilarating than its predecessor, and now all six books are available together for the first time in a"
8,4.78,68654,"Box Set containing Harry Potter and the Sorcerer's Stone, Harry Potter and the Chamber Of Secrets, Harry Potter and the Prisoner of Azkaban, Harry Potter and the Goblet Of Fire, and Harry Potter and the Order of the Phoenix!"
9,3.76,29,"Through the magic of print-on-demand technology, this ""nimble"" guide to the work of best-selling author J. K. Rowling provides the latest news about the author and her works, updated whenever there are significant developments. Unlike a conventional book, for which editions are printed in quantity every couple of years, this ""living book"" goes through frequent ""mini-editions"" and is printed fresh whenever customers place an order. Purchasers are entitled to free PDF updates! An entirely new section of analysis with more than 75 new pages will be added shortly after the release of ""Harry Potter and the Half-Blood Prince"" on July 16, 2005."
11,4.22,1575989,"A beautifully illustrated edition of the New York Times bestselling classic, timed to celebrate the pivotal 42nd anniversary of the original publication--with never-before-seen illustrations by award winner Chris Riddell Seconds before Earth is demolished to make way for a galactic freeway, Arthur Dent is plucked off the planet by his friend Ford Prefect, a researcher for the revised edition of The Hitchhiker's Guide to the Galaxy who, for the last fifteen years, has been posing as an out-of-work actor.Together, this dynamic pair begin a journey through space aided by a galaxyful of fellow travelers: Zaphod Beeblebrox--the two-headed, three-armed ex-hippie and totally out-to-lunch president of the galaxy; Trillian (formerly Tricia McMillan), Zaphod's girlfriend, whom Arthur tried to pick up at a cocktail party once upon a time zone; Marvin, a paranoid, brilliant, and chronically depressed robot; and Veet Voojagig, a former graduate student obsessed with the disappearance of all the ballpoint pens he's bought over the years.Where are these pens? Why are we born? Why do we die? For all the answers, stick your thumb to the stars!"
12,4.35,305744,"At last in paperback in one complete volume, here are the five novels from Douglas Adams's Hitchhiker series. ""The Hitchhiker's Guide to the Galaxy""Seconds before the Earth is demolished for a galactic freeway, Arthur Dent is saved by Ford Prefect, a researcher for the revised Guide. Together they stick out their thumbs to the stars and begin a wild journey through time and space.""The Restaurant at the End of the Universe""Facing annihilation at the hands of warmongers is a curious time to crave tea. It could only happen to the cosmically displaced Arthur Dent and his comrades as they hurtle across the galaxy in a desperate search for a place to eat.""Life, the Universe and Everything""The unhappy inhabitants of planet Krikkit are sick of looking at the night sky- so they plan to destroy it. The universe, that is. Now only five individuals can avert Armageddon: mild-mannered Arthur Dent and his stalwart crew.""So Long, and Thanks for All the Fish""Back on Earth, Arthur Dent is ready to believe that the past eight years were all just a figment of his stressed-out imagination. But a gift-wrapped fishbowl with a cryptic inscription conspires to thrust him back to reality. So to speak.""Mostly Harmless""Just when Arthur Dent makes the terrible mistake of starting to enjoy life, all hell breaks loose. Can he save the Earth from total obliteration? Can he save the Guide from a hostile alien takeover? Can he save his daughter from herself?Also includes the short story ""Young Zaphod Plays It Safe""."
14,4.22,1575989,"Seconds before the Earth is demolished to make way for a galactic freeway, Arthur Dent is plucked off the planet by his friend Ford Prefect, a researcher for the revised edition of the The Hitch Hiker's Guide to the Galaxy who, for the last fifteen years, has been posing as an out of work actor. Together this dynamic pair begin their journey through space aided by quotes from The Hitch Hiker's Guide ""A towel is about the most massively useful thing an interstellar hitchhiker can have"" and a galaxy-full of fellow travellers: Zaphod Beeblebrox - the two-headed, three-armed ex-hippie and totally out to lunch president of the galaxy; Trillian, Zaphod's girlfriend (formally Tricia McMillan), whom Arthur tried to pick up at a cocktail party once upon a time zone; Marvin, a paranoid, brilliant and chronically depressed robot; Veet Voojagig, a former graduate student who is obsessed with the disappearance of all the ball-point pens he has bought over the years."
15,3.73,82,"Embarking on a lean journey is similar to hitchhiking -- there are many roads on which to wander and no single one is right for all. This book reveals the most critical lessons learned over the authors' combined 30-plus years of exploring lean highways and shares stories based on real-world applications. The authors focus on areas where most lean efforts fail to illustrate steps to take to reenergize, accelerate and sustain a lean transformation. The book's ten chapters cover lean principles and thinking, lean leadership moves, the roadmap for lean transformation, common pitfalls of lean journeys, building an operating system, lean accounting, lean material management, lean in service organizations, and how individuals can apply lean to improve themselves. The book concludes with interviews of lean practitioners on the front lines of change at Chrysler, Ross Controls, DTE Energy. RSR Corporation, and Nemak."
17,4.34,798,"Many are familiar with Douglas Adams's classic Hitchhiker's Guide to the Galaxy series, but few know that these books started out as a multi-part series performed on BBC radio. This installment, part four, is a robust radio dramatization of So Long and Thanks for All the Fish. The Earth has miraculously reappeared and Arthur Dent is in love with the otherworldly Fenchurch, but Ford Prefect has an idea that might burst Arthur’s happy little bubble. What is really going on with Arthur’s dream girl, where have all the dolphins gone, and what was their departing message to mankind?"
18,4.35,305744,"""The Hitchhiker's Guide to the Galaxy""Seconds before the Earth is demolished for a galactic freeway, Arthur Dent is saved by Ford Prefect, a researcher for the revised Guide. Together they stick out their thumbs to the stars and begin a wild journey through time and space.""The Restaurant at the End of the Universe""Facing annihilation at the hands of warmongers is a curious time to crave tea. It could only happen to the cosmically displaced Arthur Dent and his comrades as they hurtle across the galaxy in a desperate search for a place to eat.""Life, the Universe and Everything""The unhappy inhabitants of planet Krikkit are sick of looking at the night sky- so they plan to destroy it. The universe, that is. Now only five individuals can avert Armageddon: mild-mannered Arthur Dent and his stalwart crew.""So Long, and Thanks for All the Fish""Back on Earth, Arthur Dent is ready to believe that the past eight years were all just a figment of his stressed-out imagination. But a gift-wrapped fishbowl with a cryptic inscription conspires to thrust him back to reality. So to speak.""Mostly Harmless""Just when Arthur Dent makes the terrible mistake of starting to enjoy life, all hell breaks loose. Can he save the Earth from total obliteration? Can he save the Guide from a hostile alien takeover? Can he save his daughter from herself?Also includes the short story ""Young Zaphod Plays It Safe""."
19,4.37,765,"Panic! It's the last installment of The Hitchhiker's Guide to the Galaxy, with a brand new full-cast dramatization of Mostly Harmless, the final book in Douglas Adams' famous ""trilogy in five parts."" While frequent flyer Arthur Dent searches the universe for his lost love, Ford Prefect discovers a disturbing blast from the past at. The Hitchhiker's Guide HQ. Meanwhile, on one of many versions of Earth, a blonder, more American Trillian gets tangled up with a party of lost aliens having an identity crisis. A stolen ship, a dramatic stampede, and a new and sinister Guide lead to a race to save the earth. . .again."
21,4.18,338352,"In Bryson's biggest book, he confronts his greatest challenge: to understand—and, if possible, answer—the oldest, biggest questions we have posed about the universe and ourselves. Taking as territory everything from the Big Bang to the rise of civilization, Bryson seeks to understand how we got from there being nothing at all to there being us. To that end, he has attached himself to a host of the world’s most advanced (and often obsessed) archaeologists, anthropologists, and mathematicians, travelling to their offices, laboratories, and field camps. He has read (or tried to read) their books, pestered them with questions, apprenticed himself to their powerful minds. A Short History of Nearly Everything is the record of this quest, and it is a sometimes profound, sometimes funny, and always supremely clear and entertaining adventure in the realms of human knowledge, as only Bill Bryson can render it. Science has never been more involving or entertaining."
22,3.46,9032,"In the early fall of 2002, famed travel Writer Bill Bryson journeyed to Kenya at the invitation of CARE International, the charity dedicated to working with local communities to eradicate poverty around the world. He arrived with a set of mental images of Africa gleaned from television broadcasts of low-budget Jungle Jim movies in his Iowa childhood and a single viewing of the film version of Out of Africa. (Also with some worries about tropical diseases, insects and large predators.) But the vibrant reality of Kenya and its people took over the second he deplaned in Nairobi, and this diary records Bill Bryson's impresssions of his trip with his inimitable trademark style of wry observation and curious insight. From the wrenching poverty of the Kibera slum in Nairobi to the meticulously manicured grounds of the Karen Blixen house and the human fossil riches of the National Museum, Bryson registers the striking contrasts of a postcolonial society in transition. He visits the astoundingly vast Great Rift Valley; undergoes the rigors of a teeth-rattling train journey to Mombasa and a hair-whitening flight through a vicious storm; and visits the refugee camps and the agricultural and economic projects where dedicated CARE professionals wage noble and dogged war against poverty, dislocation and corruption."
23,3.88,2885,
24,4.06,100213,"A CLASSIC FROM THE NEW YORK TIMES BESTSELLING AUTHOR OF ONE SUMMER Every time Bill Bryson walks out the door, memorable travel literature threatens to break out. His previous excursion along the Appalachian Trail resulted in the sublime national bestseller A Walk in the Woods. In A Sunburned Country is his report on what he found in an entirely different place: Australia, the country that doubles as a continent, and a place with the friendliest inhabitants, the hottest, driest weather, and the most peculiar and lethal wildlife to be found on the planet. The result is a deliciously funny, fact-filled, and adventurous performance by a writer who combines humor, wonder, and unflagging curiousity.Despite the fact that Australia harbors more things that can kill you in extremely nasty ways than anywhere else, including sharks, crocodiles, snakes, even riptides and deserts, Bill Bryson adores the place, and he takes his readers on a rollicking ride far beyond that beaten tourist path. Wherever he goes he finds Australians who are cheerful, extroverted, and unfailingly obliging, and these beaming products of land with clean, safe cities, cold beer, and constant sunshine fill the pages of this wonderful book. Australia is an immense and fortunate land, and it has found in Bill Bryson its perfect guide."
26,3.81,57613,"'I come from Des Moines. Somebody had to'And, as soon as Bill Bryson was old enough, he left. Des Moines couldn't hold him, but it did lure him back. After ten years in England, he returned to the land of his youth, and drove almost 14,000 miles in search of a mythical small town called Amalgam, the kind of trim and sunny place where the films of his youth were set. Instead, his search led him to Anywhere, USA; a lookalike strip of gas stations, motels and hamburger outlets populated by lookalike people with a penchant for synthetic fibres. Travelling around thirty-eight of the lower states - united only in their mind-numbingly dreary uniformity - he discovered a continent that was doubly lost; lost to itself because blighted by greed, pollution, mobile homes and television; lost to him because he had become a stranger in his own land.The Lost Continent is a classic of travel literature - hilariously, stomach-achingly funny, yet tinged with heartache - and the book that first staked Bill Bryson's claim as the most beloved writer of his generation."
28,3.9,105062,"""Suddenly, in the space of a moment, I realized what it was that I loved about Britain-which is to say, all of it.""After nearly two decades spent on British soil, Bill Bryson - bestselling author of The Mother Tongue and Made in America-decided to return to the United States. (""I had recently read,"" Bryson writes, ""that 3.7 million Americans believed that they had been abducted by aliens at one time or another, so it was clear that my people needed me."") But before departing, he set out on a grand farewell tour of the green and kindly island that had so long been his home.Veering from the ludicrous to the endearing and back again, Notes from a Small Island is a delightfully irreverent jaunt around the unparalleled floating nation that has produced zebra crossings, Shakespeare, Twiggie Winkie's Farm, and places with names like Farleigh Wallop and Titsey. The result is an uproarious social commentary that conveys the true glory of Britain, from the satiric pen of an unapologetic Anglophile."
29,3.91,39267,"With dazzling wit and astonishing insight, Bill Bryson—the acclaimed author of The Lost Continent—brilliantly explores the remarkable history, eccentricities, resilience and sheer fun of the English language. From the first descent of the larynx into the throat (why you can talk but your dog can't), to the fine lost art of swearing, Bryson tells the fascinating, often uproarious story of an inadequate, second-rate tongue of peasants that developed into one of the world's largest growth industries."
30,4.6,118864,"This four-volume, boxed set contains J.R.R. Tolkien's epic masterworks The Hobbit and the three volumes of The Lord of the Rings (The Fellowship of the Ring, The Two Towers, and The Return of the King).In The Hobbit, Bilbo Baggins is whisked away from his comfortable, unambitious life in Hobbiton by the wizard Gandalf and a company of dwarves. He finds himself caught up in a plot to raid the treasure hoard of Smaug the Magnificent, a large and very dangerous dragon.The Lord of the Rings tells of the great quest undertaken by Frodo Baggins and the Fellowship of the Ring: Gandalf the wizard; the hobbits Merry, Pippin, and Sam; Gimli the dwarf; Legolas the elf; Boromir of Gondor; and a tall, mysterious stranger called Strider. J.R.R. Tolkien's three volume masterpiece is at once a classic myth and a modern fairy tale—a story of high and heroic adventure set in the unforgettable landscape of Middle-earth"
31,4.5,606856,"The Fellowship of the Ring, part one of J.R.R. Tolkien’s epic masterpiece, first reached these shores on October 21, 1954, arriving, as C. S. Lewis proclaimed, “like lightning from a clear sky.” Fifty years and nearly one hundred million American readers later comes a beautiful new one-volume collector’s edition befitting the stature of this crown jewel of our list. With a text fully corrected under the supervision of Christopher Tolkien to meet the author’s exacting wishes, two large-format fold-out maps, a ribbon placemarker, gilded page edges, a color insert depicting Tolkien's own paintings of the Book of Mazarbul and exceptionally elegant and sturdy overall packaging housed within an attractive slipcase, this edition is the finest we’ve ever produced."
32,4.5,606856,"Classics in the genre, J.R.R. Tolkien's definitive three-book epic, the Lord of the Rings (encompassing The Fellowship of the Ring, The Two Towers, and The Return of the King), and its charming precursor, The Hobbit. That many (if not most) fantasy works are in some way derivative of Tolkien is understood, but the influence of the Lord of the Rings is so universal that everybody from George Lucas to Led Zeppelin has appropriated it for one purpose or another. Not just revolutionary because it was groundbreaking, the Lord of the Rings is timeless because it's the product of a truly top-shelf mind. Tolkien was a distinguished linguist and Oxford scholar of dead languages, with strong ideas about the importance of myth and story and a deep appreciation of nature. His epic, 10 years in the making, recounts the Great War of the Ring and the closing of Middle-Earth's Third Age, a time when magic begins to fade from the world and men rise to dominance. Tolkien carefully details this transition with tremendous skill and love, creating in the Lord of the Rings a universal and all-embracing tale, a justly celebrated classic. --Paul Hughes"
