bookID,average_rating,ratings_count,summary
515,4.04,1958,"Ruby is an increasingly popular, fully object-oriented dynamic programming language, hailed by many practitioners as the finest and most useful language available today. When Ruby first burst onto the scene in the Western world, the Pragmatic Programmers were there with the definitive reference manual, Programming Ruby: The Pragmatic Programmer's Guide.Now in its second edition, author Dave Thomas has expanded the famous Pickaxe book with over 200 pages of new content, covering all the improved language features of Ruby 1.8 and standard library modules. The Pickaxe contains four major sections:An acclaimed tutorial on using Ruby.The definitive reference to the language.Complete documentation on all built-in classes, modules, and methodsComplete descriptions of all 98 standard libraries.If you enjoyed the First Edition, you'll appreciate the expanded content, including enhanced coverage of installation, packaging, documenting Ruby source code, threading and synchronization, and enhancing Ruby's capabilities using C-language extensions. Programming for the World Wide Web is easy in Ruby, with new chapters on XML/RPC, SOAP, distributed Ruby, templating systems, and other web services. There's even a new chapter on unit testing.This is the definitive reference manual for Ruby, including a description of all the standard library modules, a complete reference to all built-in classes and modules (including more than 250 significant changes since the First Edition). Coverage of other features has grown tremendously, including details on how to harness the sophisticated capabilities of irb, so you can dynamically examine and experiment with your running code. Ruby is a wonderfully powerful and useful language, and whenever I'm working with it this book is at my side --Martin Fowler, Chief Scientist, ThoughtWorks"
533,3.75,4,"Ripped from the headlines, Robert Mercer-Nairne'ss fast-paced, riveting tale of the ensuing conflict is teeming with entertaining characters in all too believable scenarios. In a story of a war that would be Like No Other, the author paints a superb picture of the inherent complexity of truth and of lives touched so differently and profoundly by war"
543,3.57,7,"This developer’s guide for designers and programmers of mass-storage devices that use the Universal Serial Bus (USB) interface provides developers with information on how to choose storage media, interface the media to a microcontroller or other CPU, and write device firmware to access the media and perform USB communications. Comparisons of popular storage-media options to help users choose a media type for a project are included, and the types described cover hard drives and flash-memory cards such as the MultiMediaCard (MMC), Secure Digital (SD) card, and CompactFlash card. Helpful tips on developing an embedded host that can access USB mass-storage devices are also covered."
598,3.81,28009,"Travelling from New York to Mississippi to Seattle, Chuck Klosterman chases rock 'n' roll and death across a continent. 21 days later, and after three relationships, an encounter with various snakes, and a night spent snorting cocaine in a graveyard, this is his account of American culture and the meaning of celebrity."
606,4.06,592,"What started out as a few Montreal drug addicts scamming welfare make-work programs back in 1994 has become a global empire of hedonism known simply as VICE. From a 16-page newspaper about punk bands and violence to stores, a clothing line, VICE Films, VICE TV, VICE Records, viceland.com, etc., VICE has become much more than a way for three guys to get laid. It's become a lifestyle, a degrading and disgusting lifestyle of sex and drugs and rock and roll and death. This book is a collection of the irreverent, hilarious and downright scary gonzo journalism that brought three losers from the crack houses of Le Plateau to the deluxe apartments of Manhattan."
654,4.32,2494,"Of all Russian writers Leo Tolstoy is probably the best known to the Western world, largely because of  War and Peace, his epic in prose, and  Anna Karenina, one of the most splendid novels in any language. But during his long lifetime Tolstoy also wrote enough shorter works to fill many volumes. Here reprinted in one volume are his eight finest short novels, together with ""Alyosha the Pot"", the little tale that Prince Mirsky described as ""a masterpiece of rare perfection.""The Death of Ivan IlychThe CossacksFamily HappinessThe DevilThe Kreutzer SonataMaster and ManFather SergiusHaji MuradAlyosha the Pot"
679,4.09,34,"Sailing Smart is for every sailor who wants to increase his or her knowledge, understanding, and sailing expertise: the local day-sailor who wants a firmer grasp of the fundamentals, as well as the serious competitor who wants to be up on the latest, most innovative sailing techniques and racing strategies. Buddy Melges, one of the world's best-known sailors, has at last set down his highly original thoughts on how to sail well. He covers the full range of sailing experience, from the general to the specific, the basic to the highly sophisticated. Melges's message is delivered in a bright, uncluttered manner by way of applications from his own sailing experience and through step-by-step instructions on everything from basic boat handling to expert on-the-course tactics and maneuvers. The book is profusely illustrated by the noted sailing artist Ted Brennan, and each drawing is accompanied by a cogent, in-depth explanatory caption."
697,4.33,3,"Designer and author David Carson pronounced the ""End of Print"" in response to the virtual world's ever-increasing influence on design. And if ""Ortlos: Architecture of the Networks"" is any indication, it seems that the group will soon pronounce the ""End of Architecture"" (as we know it). Ortlos--which means ""placeless"" in German--is a virtual office (or platform) that deals with architectural topics, urban planning issues and interface design. Its members include a global network of architects, web designers, media theorists, net artists and IT specialists, all of whom are experts in their various fields and professions, and all of whom can collaborate on online projects that are either of interest to them, or specific to their locales. ""Ortlos"" also describes the virtual office's basic working method: not being dependent on a specific physical space to work, but located instead in networks and anywhere where an Internet connection is provided. The firm aims to generate advanced instruments for architectural and urban design, a sort of platform, a creative pool supported with information and databases: It is a virtual office that never sleeps. Designed and written by the firm's ""partners,"" ""Architecture of the Networks"" documents Ortlos' projects from 2000 to 2003. Each of the 12 projects shown and explained here by Ortlos incorporates various approaches to the fields of architecture, urban planning, media theory, product design, installation art and interface design. This new and fresh way of addressing contemporary architecture also includes a research project about network collaborations, and Carson's interpretation of Ortlos' architectural work through the specific language of graphic design."
698,3.56,20745,"In what is perhaps her richest and most deeply searching novel, Anne Tyler gives us a story about what it is to be an American, and about Maryam Yazdan, who after thirty-five years in this country must finally come to terms with her “outsiderness.”Two families, who would otherwise never have come together, meet by chance at the Baltimore airport—the Donaldsons, a very American couple, and the Yazdans, Maryam’s fully assimilated son and his attractive Iranian American wife. Each couple is awaiting the arrival of an adopted infant daughter from Korea. After the babies from distant Asia are delivered, Bitsy Donaldson impulsively invites the Yazdans to celebrate with an “arrival party,” an event that is repeated every year as the two families become more deeply intertwined.Even independent-minded Maryam is drawn in. But only up to a point. When she finds herself being courted by one of the Donaldson clan, a good-hearted man of her vintage, recently widowed and still recovering from his wife’s death, suddenly all the values she cherishes—her traditions, her privacy, her otherness—are threatened. Somehow this big American takes up so much space that the orderly boundaries of her life feel invaded.A luminous novel brimming with subtle, funny, and tender observations that cast a penetrating light on the American way as seen from two perspectives, those who are born here and those who are still struggling to fit in."
736,0.0,0,
746,4.27,15,
781,3.25,56,"Born in the projects of Spanish Harlem to a disabled mother and an abusive father, Steve DeMasco spent most of his childhood lost and angry. Drifting from one job to another, he stalked the streets as a troubled youth, barely surviving while all of his peers were either dead or in jail, until he found himself on the steps of the Shaolin Temple.Originating more than 1,500 years ago in ancient China, the Shaolin monks were simple farmers and worshippers of Buddhism who learned to protect themselves from the constant danger of bandits and overlords with a kind of ""meditation in motion,"" a nonlethal form of self-defense that didn't violate their vows of peace. As their legend grew, they became known as the Shaolin Fighting Monks, revered across the land for their spiritual dedication, enlightened message, and amazing fighting skills.DeMasco entered the Shaolin Temple to battle the demons of his past. But he got more than he bargained for. Besides learning how to wield weapons and take on multiple attackers at once, he discovered an ancient philosophy that helped melt away preconceived notions of the world, and gave him a powerful platform on which to live and grow. In The Shaolin Way, he adapts these teachings for the modern world, singling out ten secrets of survival that can help anyone live a more fulfilled life."
824,3.64,3114,"From his triumphant debut with Snow Crash to the stunning success of his latest novel, Quicksilver,  Neal Stephenson has quickly become the voice of a generation. In this now-classic political thriller, he and fellow author J. Frederick George tell a savagely witty, chillingly topical tale set in the tense moments of the Gulf War. When a foreign exchange student is found murdered at an Iowa University, Deputy Sheriff Clyde Banks finds that his investigation extends far beyond the small college town--all the way to the Middle East. Shady events at the school reveal that a powerful department is using federal grant money for highly dubious research. And what it's producing is a very nasty bug.Navigating a plot that leads from his own backyard to Washington, D.C., to the Gulf, where his Army Reservist wife has been called to duty, Banks realizes he may be the only person who can stop the wholesale slaughtering of thousands of Americans. It's a lesson in foreign policy he'll never forget."
863,3.5,28,"This book contains the real estate investment histories of four highly successful individuals. Within this publication, the investors describe the paths they took that resulted in the creation of four separate, self-sustaining real estate empires. Self-sustaining means that the companies they started would continue to flourish without the day-to-day input of the founder. To fulfill such a qualification, the founder must have built a company consisting of a group of independent real estate entrepreneurs who are capable of managing and growing the business to the next level of success. The investors contributing to this book have achieved that goal."
888,3.58,2009,
890,3.88,2111463,"An intimate portrait of two men who cherish the slim bond between them and the dream they share in a world marred by petty tyranny, misunderstanding, jealousy, and callousness. Clinging to each other in their loneliness and alienation, George and his simple-minded friend Lennie dream, as drifters will, of a place to call their own—a couple of acres and a few pigs, chickens, and rabbits back in Hill Country where land is cheap. But after they come to work on a ranch in the fertile Salinas Valley of California, their hopes, like ""the best laid schemes o' mice an' men,"" begin to go awry.Of Mice and Men also represents an experiment in form, as Steinbeck described his work, ""a kind of playable novel, written in novel form but so scened and set that it can be played as it stands."" A rarity in American letters, it achieved remarkable success as a novel, a Broadway play, and three acclaimed films. Steinbeck's tale of commitment, loneliness, hope, and loss remains one of America's most widely read and beloved novels.--front flap"
899,3.88,2111463,"NEW LONGMAN LITERATURE titles provide an excellent selection of popular modern fiction and are suitable for 14-18 year olds of all abilities. Notes and questions are provided at the beginning of each section to help guide the student's understanding of key themes and language. A programme of study provides practice in skills required at GCSE.“Guys like us, that work on ranches, are the loneliest guys in the world. They got no family. They don’t belong no place ...With us it ain’t like that.We got a future ... because I got you to look after me and you got me to look after you.”George and Lennie are migrant American labourers –the one alert and protective and the other strong, stupid and potentially dangerous. This is the powerful story of their relationship and their dreams of finding a more stable and less lonely way of life. This edition contains notes to help students' understanding.--back cover"
912,4.1,451882,
965,3.91,2866173,"El arma más poderosa creada por el hombre, una organización secreta sedienta de venganza... y apenas unas horas para evitar el desastre.  La eterna pugna entre ciencia y religión se ha convertido en una guerra muy real.  En un laboratorio de máxima seguridad, aparece asesinado un científico con un extraño símbolo grabado a fuego en su pecho. Para el profesor Robert Langdon no hay duda: los Illuminati, los hombres enfrentados a la Iglesia desde los tiempos de Galileo, han regresado. Y esta vez disponen de la más mortífera arma que ha creado la humanidad, un artefacto con el que pueden ganar la batalla final contra su eterno enemigo. Acompañado de una joven científica y un audaz capitán de la Guardia Suiza, Langdon comienza una carrera contra reloj, en una búsqueda desesperada por los rincones más secretos de El Vaticano. Necesitará todo su conocimiento para descifrar las claves ocultas que los Illuminati han dejado a través de los siglos en manuscritos y templos, y todo su coraje para vencer al despiadado asesino que siempre parece llevarle la delantera.  El autor de El Código Da Vinci nos arrastra a una espiral de acción sin pausa, un impactante thriller donde se suceden las sorpresas y se revelan algunos de los más oscuros enigmas de la historia. Fuerzas que han permanecido  ocultas durante siglos y que ahora planean destruir la Iglesia... literalmente."
979,3.73,629808,
982,3.73,629808,
984,4.03,643,"A deep freeze is bearing down on the Florida Everglades, the kind of brutal storm the locals call a killing rain. For Detective Louis Kincaid, the coldest night of the year has brought a terrifying new chill- a grisly discovery that tightens his every nerve in warning........The body proves this is no routine case. It's the start of a nightmare. & When the killer chooses his next victim, theres no doubt the detective is matching wits with a predator who is as ruthless as they come. Now with time running out, Kincaid is on a desperate hunt of his own, tracking a twisted adversary one step away from committing the ultimate horror......."
1005,4.17,259988,"Think and Grow Rich has been called the ""Granddaddy of All Motivational Literature."" It was the first book to boldly ask, ""What makes a winner?"" The man who asked and listened for the answer, Napoleon Hill, is now counted in the top ranks of the world's winners himself. The most famous of all teachers of success spent ""a fortune and the better part of a lifetime of effort"" to produce the ""Law of Success"" philosophy that forms the basis of his books and that is so powerfully summarized in this one.In the original Think and Grow Rich, published in 1937, Hill draws on stories of Andrew Carnegie, Thomas Edison, Henry Ford, and other millionaires of his generation to illustrate his principles. In the updated version, Arthur R. Pell, Ph.D., a nationally known author, lecturer, and consultant in human resources management and an expert in applying Hill's thought, deftly interweaves anecdotes of how contemporary millionaires and billionaires, such as Bill Gates, Mary Kay Ash, Dave Thomas, and Sir John Templeton, achieved their wealth. Outmoded or arcane terminology and examples are faithfully refreshed to preclude any stumbling blocks to a new generation of readers."
1023,3.93,44,
1031,3.64,1944,"It’s not good enough to want it. You’ve got to know how to get it. Real estate titan, bestselling author, and TV star Donald J. Trump is the man to teach you the billionaire mind-set–how to think about money, career skills, and life. Here is crucial advice on investing in real estate from the expert, everything from dealing with brokers to renovating to assessing the value of property, buying and selling, and securing a mortgage. Trump will show you how to cut costs, decide how much risk to assume in your investments, and divide up your portfolio. He’ll also teach you how to impress anyone, how to correct or criticize someone effectively, and how to know if your friends are loyal–everything you need to know to get ahead.And once you’ve earned your money, you’ve got to learn to spend it well. Trump presents his consumer guide to the best things in life, from wine to golf clubs to engagement rings. Check out the billionaire lifestyle–how they shop and what they buy. Even if you’re not superwealthy, you can afford many of these luxuries.And what look inside the Trump world would be complete without The Apprentice? Trump will take you behind the scenes, from the end of season one and into season two, with insights into the making and the meaning of TV’s hottest show.As Donald Trump proves, getting rich is easy. Staying rich is harder. Your chances are better, and you’ll have more fun, if you think like a billionaire. This is the book that will help you make a real difference in your life.From the Hardcover edition."
1037,3.59,442,"Trump's story begins when many real estate moguls went belly-up in what he calls the Great Depression of 1990.  Trump reveals how he renegotiated millions of dollars in bank loans and survived the recession, paving the way for a resurgence, during which he built the most successful casino operation in Atlantic City, broke ground on one of the biggest and most lucrative development projects ever undertaken in New York City, and outsmarted one of South America's richest men for rights to the Miss Universe pageant.Blunt, outrageous, smart as hell, and full of hilarious stories--check out his chapter ""The Art of the Prenuptial Agreement""--Trump tells it like it is: the women in his life; the wild and woolly deals; negotiating tactics; his investment philosophy; and his strategy for success or coming back from adversity.Whether you love him or hate him, one thing is certain about Donald Trump: He is a true American original, with great instincts and billion-dollar dreams.  The Art of the Comeback is Trump at his best--unpredictable, irreverent, and irrepressible."
1043,4.09,163,"A laugh-out-loud humor book from one of the most celebrated comedians, Bernie Mac, the star of Fox's The Bernie Mac Show, winner of the prestigious Peabody Award. The Chicago-bred performer and royal king of the Original Kings of Comedy, Bernie Mac, has won over countless fans of cutting comedy and family humor with an edgy show that tells it like it is but never loses heart. No surprise, Mac has earned a reputation as perhaps the truest voice of modern humor. Here, in his debut book, Mac brilliantly captures the R-rated side of his comedic genius in print. Touring through a wide range of topics with equal parts insight and irreverence, Bernie presents a way of looking at the world guaranteed to make you laugh. Tackling superstar athletes, the movie business, his fellow comedians, his marriage, and, of course, his friends and family, Mac offers side-splitting riffs on sex, religion, hygiene, money, and more. Nobody is safe; nothing is sacred. Not even Bernie himself. Throughout I Ain't Scared of You, Mac turns his humor inward, firing off hilarious self-deprecating salvos about his golf game and his own hypocrisies. Bernie Mac's hit show and his vital live performances have earned him critical acclaim and international popularity. Now, I Ain't Scared of You reveals his humor whole—unpretentious, unafraid, and unbelievably funny and raw."
1076,3.74,51034,"Young Julie Harmon works ""hard as a man,"" they say, so hard that at times she's not sure she can stop. People depend on her to slaughter the hogs and nurse the dying. People are weak, and there is so much to do. At just seventeen she marries and moves down into the valley of Gap Creek, where perhaps life will be better.But Julie and Hank's new life in the valley, in the last years of the nineteenth century, is more complicated than the couple ever imagined. Sometimes it's hard to tell what to fear most—the fires and floods or the flesh-and-blood grifters, drunks, and busybodies who insinuate themselves into their new life. To survive, they must find out whether love can keep chaos and madness at bay. Their struggles with nature, with work, with the changing century, and with the disappointments and triumphs of their union make Gap Creek a timeless story of a marriage.A native of the North Carolina mountains, Robert Morgan was raised on land settled by his Welsh ancestors. An accomplished novelist and poet, he has won the James B. Hanes Poetry Prize, the North Carolina Award in Literature, and the Jacaranda Review Fiction Prize. His short stories have appeared in Prize Stories: The O. Henry Awards and New Stories from the South, and his novel The Truest Pleasure was a finalist for the Southern Book Critics Circle Award for Fiction."
1083,3.99,233006,"One of the greatest classics of our time, this is the powerfully moving story of peasant Wang Lung--Of the family he founded that would one day become a powerful dynasty; of the gods he implored, sometimes with humility, sometimes with anger; and, above all, of the earth that sustained him, the land he made to prosper against the ravages of nature and the savage attcks of bandit tribes."
100,3.78,91,"Blend your creative spirit with the quick and easy projects found inside Simply Beautiful Beading.From casual to sophisticated, and everything in between, you'll find beading designs to fit your personal style. Inside, you'll discover 53 simple yet stylish beading projects for exquisite jewelry, accessories and home decor, including: •modern glass bead chokers•semiprecious stone set•charm bracelets•wired-pearl barrettes•wineglass charms•hanging votive candle holder•and more than 35 variation projects for even more simply beautiful ideas!"
101,3.46,39,"“A story of love and loss, Chasing Jordan is a quiet novel with a thunderclap at its heart. With this first novel, Ms. Boehringer gives notice that she is a writer to watch. This is my kind of novel. Whatever Heidi Boehringer writes next, I will read.”—Harry CrewsWhen Meg approaches home with her daughter in the back seat, she sees her husband spying on the neighbor, who is gardening in very short shorts. In this moment of distraction, she hits and kills her two-year-old son, Jordan.With humor that is both provocative and totally unpredictable, Chasing Jordan shows how the road to forgiveness is both twisted and dangerous."
102,3.6,92,"
Connor Riordan was the last Person she wanted to walk down the aisle with...
Even if it was only at her brother's wedding. It was too painful a reminder of Beth Curtis's girlhood fantasies, featuring none other than Connor himself. That crush had culminated in one night of passion and seven years of bitterness; and even now, Beth's anger warred against her attraction toward Connor. Still, there was too much history--too many secrets--that would prevent her from ever loving him again.But when a storm strands the two together, Beth is in for a surprise. Connor has a secret of his own. He plans on seducing Beth--a seduction seven years in the making..."
103,3.87,77234,"Centuries have passed on Dune, and the planet is green with life. Leto, the son of Dune's savior, is still alive but far from human, and the fate of all humanity hangs on his awesome sacrifice...""Rich fare...heady stuff.""--Los Angeles Times"
105,3.92,52317,"Alternate Cover Edition of ISBN 0441102670.The desert planet Arrakis, called Dune, has been destroyed. Now, the Bene Gesserit, heirs to Dune's power, have colonized a green world--and are turning it into a desert, mile by scorched mile.Here is the last book Frank Herbert wrote before his death. A stunning climax to the epic Dune legend that will live on forever..."
106,3.89,164887,"Dune Messiah continues the story of the man Muad'dib, heir to a power unimaginable, bringing to completion the centuries-old scheme to create a super-being.""Brilliant...It is all that Dune was, and maybe a little bit more.""--Galaxy Magazine"
