bookID,average_rating,ratings_count,summary
92,3.65,78,"In Mapping the Big Picture, Heidi Hayes Jacobs describes a seven-step process for creating and working with curriculum maps, from data collection to ongoing curriculum review. She discusses the importance of asking ""essential questions"" and of designing assessments that reflect what teachers know about the students in their care. She also offers a viable alternative to the ""curriculum committees"" that are part of almost every school district in the United States."
93,4.0,181946,
94,3.25,59,"Curriculum mapping is said to remove the clutter that may interfere with learning and teaching. It sorts lessons and units into consistent plans that teachers, schools, and districts can access to ensure content is consistent and also progresses along with students. Jacobs and her contributors describe how to set up a mapping project, work on the project as a team, and use mapping in special settings such as in an independent or alternative school. They show how to create consistent benchmarks and use the resulting maps to integrate new technology, new data, decision-making structures, and staff development opportunities. The appendices include samples.Preparing educators to implement mapping procedures, * Using software to create unique mapping databases, * Integrating decision-making structures and staff development initiatives through mapping, * Helping school communities adjust to new curriculum review processes, and * Making mapping an integral part of literacy training."
95,3.88,89,"A plain, hardworking seamstress, Rebecca had no business being attracted to wealthy Caleb Adams. Born fatherless in a brothel Rebecca knew what males were made of. And Caleb was clearly as faithless as they came, scandalizing their Kansas cowtown with his fancy city women. Though his carnal lips tempted Rebecca beyond reason, she couldn't afford to love a man like Caleb. For the price might be another fatherless babe....Why, Caleb mused, would he be drawn to a calico-clad dressmaker when sirens in silk were his for the asking? Still, innocent Rebecca unaccountably stirred him. Left him indifferent to costly perfumes. Made him crave her simpler scents of cinnamon and roses. Caleb vowed to trust no woman with his heart. But he had to have sweet Rebecca no matter what the cost...."
96,4.45,1065,"Today in one of Southern Africa's most disaster-torn nations, Rolland and Heidi Baker are at the center of a major move of God's Spirit. The last four years have seen them plant and take responsibility for around 6,000 churches as thousands of Mozambiquans have given their lives to Christ in an unprecedented revival. During this time, they have also witnessed numerous acts of God's power. Miracles of provision, healing, deliverance, and even raising the dead, have become every day occurrences. This adventure began when Rolland and Heidi Baker, founders of IRIS Ministries, and both natives of California, USA, answered God's call to minister to the poorest of the poor. Rolland describes this best in the introduction to the forthcoming book that tells the story, "" There's Always Enough"". In his introduction to the book, Rolland Baker says: ""Jesus developed our faith over the years in many countries and ministry situations for a reason. Today He has given us oversight over five thousand churches in one of the poorest areas of the world. We live in Mozambique, in the south-east corner of Africa, a land that has suffered horribly from decades of warfare and natural disaster. Finally the people are desperate for Jesus and no other. Revival is spreading. In large sections of central Mozambique and southern Malawi we have simple, mud-hut churches in virtually every village. They grow until there are as many as can hear the sound of a preacher's voice."" ""More are being added continuously, and now others in countries around us are calling for ministry and help, desperate to be a part of this fire. The gospel of Jesus Christ is enough for them all. He is good and faithful,the Master Lover. They just want Him. They have been poor and wretched, but now they possess all things in Him. We dare to approach them, we dare to preach to them, we dare to pick up the helpless, abandoned and dying, because He died for us and rose again on our behalf. We eat and drink from His body and blood, and as a result, there will always be enough..."""
97,2.85,420,"Reuniting to celebrate their father's seventy-fifth birthday, the Miller siblings, each of whom is expecting first children of their own, struggle with difficult life challenges, from the eldest's confinement in a wheelchair after a devastating accident, to the middle son's anticipation of twins, to the pregnant youngest daughter's single status."
98,3.9,16737,"Some things about babies, happily, will never change. They still arrive warm, cuddly, soft, and smelling impossibly sweet. But how moms and dads care for their brand-new bundles of baby joy has changed—and now, so has the new-baby bible.  Announcing the completely revised third edition of What to Expect the First Year. With over 10.5 million copies in print, First Year is the world’s best-selling, best-loved guide to the instructions that babies don’t come with, but should. And now, it’s better than ever. Every parent’s must-have/go-to is completely updated.  Keeping the trademark month-by-month format that allows parents to take the potentially overwhelming first year one step at a time, First Year is easier-to-read, faster-to-flip-through, and new-family-friendlier than ever—packed with even more practical tips, realistic advice, and relatable, accessible information than before. Illustrations are new, too.  Among the changes: Baby care fundamentals—crib and sleep safety, feeding, vitamin supplements—are revised to reflect the most recent guidelines. Breastfeeding gets more coverage, too, from getting started to keeping it going. Hot-button topics and trends are tackled: attachment parenting, sleep training, early potty learning (elimination communication), baby-led weaning, and green parenting (from cloth diapers to non-toxic furniture). An all-new chapter on buying for baby helps parents navigate through today’s dizzying gamut of baby products, nursery items, and gear. Also new: tips on preparing homemade baby food, the latest recommendations on starting solids, research on the impact of screen time (TVs, tablets, apps, computers), and “For Parents” boxes that focus on mom’s and dad’s needs. Throughout, topics are organized more intuitively than ever, for the best user experience possible."
99,3.65,37,"Men have traditionally held tight to the treasured title of ""Player,"" but why shouldn't women be able to call the shots in an affair - whether one-night stand, indeterminate fling, or live-in relationship? In this full-color book featuring vibrant collage-style graphics, Hollywood Madam Heidi Fleiss shows how to gain and keep control. Well versed in the intricacies of the male psyche, Fleiss offers time-tested strategies and hard-won wisdom on how to survive the love-go-round and come out on top. The book covers everything the modern woman needs to know, from cultivating self-esteem (""Be yourself, relax, get naked together"") to post-sex etiquette (""Get up and be on your way with a smile"") to unusual gifts that will keep a man grateful - and drooling (""Put on a crazy sex show "") The Player's Handbook is a witty how-to guide to love and lust for the contemporary woman."
117,3.88,61479,"With more than ten million copies sold, Frank Herbert's magnificent Dune books stand among the major achievements of the human imagination. In this, the fifth and most spectacular Dune book of all, the planet Arrakis--now called Rakis--is becoming desert again. The Lost Ones are returning home from the far reaches of space. The great sandworms are dying. And the children of Dune's children awaken from empire as from a dream, wielding the new power of a heresy called love..."
133,3.5,225,"Thinking about buying or selling items on eBay? Whether you want to use eBay to make smart bids and win auctions or turn household clutter into cash, eBay for Dummies, Fifth Edition is your passport to the most successful trading community on the planet. Beginning with an overview of what eBay is and how to become a registered user, eBay for Dummies helps you discover how you can:Search for items to buy and list items to sell on eBay Place a bid--and determine how much you should spend Use pictures and basic HTML to make your eBay listings more appealing Communicate well and close deals without a problem Identify auction terms (reserve price, starting bid, Buy It Now, etc.) Organize your transactions and interactions using the My eBay page Resolve buying and selling issues with eBay's Trust & Safety program And much more! Registering at eBay makes you part of a really unique community of people who like to collect, buy, and sell items of just about every kind! So if you're ready to join the millions of people who use their home computers to make great deals, buy cool stuff, and turn a profit, eBay for Dummies does all the legwork so you can sit back and let the bidding begin!"
157,4.06,724403,"Married to a powerful government minister, Anna Karenina is a beautiful woman who falls deeply in love with a wealthy army officer, the elegant Count Vronsky. Desperate to find truth and meaning in her life, she rashly defies the conventions of Russian society and leaves her husband and son to live with her lover. Condemned and ostracized by her peers and prone to fits of jealousy that alienate Vronsky, Anna finds herself unable to escape an increasingly hopeless situation. Set against this tragic affair is the story of Konstantin Levin, a melancholy landowner whom Tolstoy based largely on himself. While Anna looks for happiness through love, Levin embarks on his own search for spiritual fulfillment through marriage, family, and hard work. Surrounding these two central plot threads are dozens of characters whom Tolstoy seamlessly weaves together, creating a breathtaking tapestry of nineteenth-century Russian society. From its famous opening sentence—""Happy families are all alike; every unhappy family is unhappy in its own way”—to its stunningly tragic conclusion, this enduring tale of marriage and adultery plumbs the very depths of the human soul."
183,3.99,1108104,"Meg Murry ne dort pas cette nuit.Dehors, la tempête fait rage et son père est parti depuis si longtemps... Charles Wallace, son petit frère, est dans la cuisine. Il attend Meg. Il sait qu'elle va descendre. Et qu'une fabuleuse vieille dame, Mrs. Quiproquo, va frapper à la porte et les emmener à la recherche de leur père, dans la cinquième dimension."
206,3.29,14,"During the hottest days of the summer of 1863, while the nation's attention was focused on a small town in Pennsylvania known as Gettysburg, another momentous battle was being fought along the banks of the Mississippi. In the longest single campaign of the war, the siege of Vicksburg left 19,000 dead and wounded on both sides, gave the Union Army control of the Mississippi, and left the Confederacy cut in half. In this highly-anticipated new work, Christopher Waldrep takes a fresh look at how the Vicksburg campaign was fought and remembered. He begins with a gripping account of the battle, deftly recounting the experiences of African-American troops fighting for the Union. Waldrep shows how as the scars of battle faded, the memory of the war was shaped both by the Northerners who controlled the battlefield and by the legacies of race and slavery that played out over the decades that followed."
210,4.2,85,"Winner of the Pearson Writers' Trust Non-Fiction Prize, the inaugural Shaughnessy Cohen Prize for political writing, and the Dorothy Shoichet Prize for History from the Canadian Jewish Book Awards.One of the most urgent issues facing the world today is how countries shape historical memory in the aftermath of calamity, making decisions that cast long shadows into the future. Combining gripping storytelling with sharp observation, Erna Paris takes us on an extraordinary journey through four continents to explore how nations reinvent themselves after cataclysmic events. She travels through the United States, with its long-buried memory of slavery; to South Africa, where the Truth and Reconciliation Commission struggles to heal the wounds left by apartheid; to Japan, France, and Germany, where the unresolved pain of Hiroshima and the Holocaust still resonate; and to the former Yugoslavia, where she exposes the cynical shaping of historical memory. Through its insightful analysis, Long Shadows compels us to question where we stand as individuals in relation to our own collective histories."
213,3.87,1327,"Miami homicide detective Hoke Moseley is called to a posh Miami neighborhood to investigate a lethal overdose. There he meets the alluring stepmother of the decedant, and begins to wonder about dating a witness. Meanwile, he has been threatened with suspension by his ambitious new chief unless he leaves his beloved, if squalid, suite at the El Dorado Hotel, and moves downtown. With free housing hard to come by, Hoke is desperate to find a new place to live. His difficulties are only amplified by an assignment to re-investigate fifty unsolved murders, the unexpected arrival of his two teenage daughters, and a partner struggling with an unwanted pregnancy. With few options and even fewer dollars, he decides that the suspicious and beautiful stepmother of the dead junkie might be a compromised solution to all of his problems.Packed with atmosphere and humor, New Hope for the Dead is a classic murder mystery by one of the true masters of the genre. Now back in print, Charles Willeford’s tour de force is an irresistible invitation to become acquainted with one of the greatest detective characters of all time."
217,4.36,44,A collection of three Charles Willeford thrillers. Cockfighter is set in the seamy underbelly of southern rural life in the USA; The Burnt Orange Heresy features an evil and complicated art-dealer; and Pick-Up tells the story of an alcoholic woman's attempts to avoid destroying herself.
219,3.64,162,"This reissue of Willeford's 1963 pulp classic is a timely reminder that madness is truly the dark heart of politics. Written at a time when people still had faith in their elected leaders, Willeford's book laid bare the American dream. There is an almost Chekhovian wistfulness in the treatment of his stories, which belies their considerable impact. ""The most eloquently brainy and exacting pulp fiction ever fabricated!"" -- Village VoiceContains the stories:1. The Machine in Ward Eleven2. Selected Incidents3. A Letter to A.A. (Almost Anybody)4. Jake's Journal5. ""Just Like on Television--""6. The Alectrymancer"
234,4.17,986,"The absurd and fanciful verses of Edward Lear-from ""The Owl and the Pussy-cat"" to ""The Jumblies,"" from ""The Scroobious Pip"" to countless limericks-have enchanted generations of readers, children and adults alike. This delightful collection, the most comprehensive ever compiled of his work, presents all of Lear's verse and other nonsense writings, including stories, letters, and illustrated alphabets, as well as previously unpublished material. Featuring Lear's own line drawings throughout and an introduction by leading Lear authority Vivien Noakes, this captivating volume reveals a complex man of ample talents, achievements, and influence-and is teeming with timeless nonsense."
255,4.14,123,
275,3.74,40940,
295,3.84,432607,"""For sheer storytelling delight and pure adventure, Treasure Island has never been surpassed. From the moment young Jim Hawkins first encounters the sinister Blind Pew at the Admiral Benbow Inn until the climactic battle for treasure on a tropic isle, the novel creates scenes and characters that have fired the imaginations of generations of readers. Written by a superb prose stylist, a master of both action and atmosphere, the story centers upon the conflict between good and evil - but in this case a particularly engaging form of evil. It is the villainy of that most ambiguous rogue Long John Silver that sets the tempo of this tale of treachery, greed, and daring. Designed to forever kindle a dream of high romance and distant horizons, Treasure Island is, in the words of G. K. Chesterton, 'the realization of an ideal, that which is promised in its provocative and beckoning map; a vision not only of white skeletons but also green palm trees and sapphire seas.' G. S. Fraser terms it 'an utterly original book' and goes on to write: 'There will always be a place for stories like Treasure Island that can keep boys and old men happy.'"
298,3.84,432607,"Robert Louis Stevenson’s classic pirate adventure that has thrilled readers for over a hundred years.Masterfully crafted, Treasure Island is a stunning yarn of piracy on the fiery tropic seas—an unforgettable tale of treachery that embroils a host of legendary swashbucklers, from honest young Jim Hawkins, to sinister, two-timing Israel Hands, to evil incarnate, blind Pew. But above all, Treasure Island is a complex study of good and evil, as embodied by that hero-villain Long John Silver, the merrily unscrupulous buccaneer-rogue whose greedy quest for gold cannot help but win the heart of every soul who ever longed for romance, treasure, and adventure."
299,3.84,432607,"Unrivaled in literature, Stevenson's Treasure Island is among the most delightful adventure romances of all time. From young Jim Hawkins' first encounter with an old buccaneer and his tresure map to the final daring skirmish with the treacherous pirate Long John Silver, this classic work enchants and fuels the imagination with beautiful illustrations."
318,4.0,12,"A startling 21st century detailed prophecy recorded in October 1997! Gain important prophetic ""inside information"" about 57 nations: read about upcoming revivals, wars, economic conditions, miracles, weather patterns, population shifts, natural disasters, investments, gavernments, world religions, plus much, much more!"
320,4.09,820440,"The brilliant, bestselling, landmark novel that tells the story of the Buendia family, and chronicles the irreconcilable conflict between the desire for solitude and the need for love—in rich, imaginative prose that has come to define an entire genre known as ""magical realism."""
349,4.14,125222,"Robert A. Heinlein was the most influential science fiction writer of his era, an influence so large that, as Samuel R. Delany notes, ""modern critics attempting to wrestle with that influence find themselves dealing with an object rather like the sky or an ocean."" He won the Hugo Award for best novel four times, a record that still stands. The Moon is a Harsh Mistress was the last of these Hugo-winning novels, and it is widely considered his finest work.It is a tale of revolution, of the rebellion of the former Lunar penal colony against the Lunar Authority that controls it from Earth. It is the tale of the disparate people - a computer technician, a vigorous young female agitator, and an elderly academic - who become the rebel movement's leaders. And it is the story of Mike, the supercomputer whose sentience is known only to this inner circle, and who for reasons of his own is committed to the revolution's ultimate success.The Moon is a Harsh Mistress is one of the high points of modern science fiction, a novel bursting with politics, humanity, passion, innovative technical speculation, and a firm belief in the pursuit of human freedom.The Moon is a Harsh Mistress is the winner of the 1967 Hugo Award for Best Novel."
373,3.91,28206,
385,3.58,11594,"One of the most salient features of our culture is that there is so much bullshit. Everyone knows this. Each of us contributes his share. But we tend to take the situation for granted. Most people are rather confident of their ability to recognize bullshit and to avoid being taken in by it. So the phenomenon has not aroused much deliberate concern. We have no clear understanding of what bullshit is, why there is so much of it, or what functions it serves. And we lack a conscientiously developed appreciation of what it means to us. In other words, as Harry Frankfurt writes, ""we have no theory.""Frankfurt, one of the world's most influential moral philosophers, attempts to build such a theory here. With his characteristic combination of philosophical acuity, psychological insight, and wry humor, Frankfurt proceeds by exploring how bullshit and the related concept of humbug are distinct from lying. He argues that bullshitters misrepresent themselves to their audience not as liars do, that is, by deliberately making false claims about what is true. In fact, bullshit need not be untrue at all.Rather, bullshitters seek to convey a certain impression of themselves without being concerned about whether anything at all is true. They quietly change the rules governing their end of the conversation so that claims about truth and falsity are irrelevant. Frankfurt concludes that although bullshit can take many innocent forms, excessive indulgence in it can eventually undermine the practitioner's capacity to tell the truth in a way that lying does not. Liars at least acknowledge that it matters what is true. By virtue of this, Frankfurt writes, bullshit is a greater enemy of the truth than lies are."
421,4.13,20262,"First published in 1979, Joan Didion's The White Album records indelibly the upheavals and aftermaths of the 1960s.Examining key events, figures, and trends of the era—including Charles Manson, the Black Panthers, and the shopping mall—through the lens of her own spiritual confusion, Joan Didion helped to define mass culture as we now understand it. Written with a commanding sureness of tone and linguistic precision, The White Album is a central text of American reportage and a classic of American autobiography."
438,5.0,2,"New York Trilogy follows the lead character, Perry, from his days as a student at New York University to his initiation into the gay scene, the early days of the AIDS crisis, and his first relationships.When I began writing this book, I didn't realize that it would eventually become a historical record of a particular time and place, but that is true of any work of art. Between the devastation of the AIDS crisis, which has literally wiped out an entire generation of gay men, and the economic transformation of New York City in general, and the East Village in particular, the East Village and New York City of today are virtually unrecognizable from the places I first started writing about in 1981."
443,3.88,41,"Hal Halliday's partner Barney Kluger is dead and Hal is keeping the business going without really knowing why. The only person who needs him and who keeps him going is the streetgirl who brings him free meals from her noodle bar. But then a holodrama star approaches Hal to find her sister and Hal is drawn into the world of dreams set up by VR magnate Mantoni. Eric Brown is unique amongst the new generation of British SF writers in the sensitivity and depth of his characterisation. His novels are infused with a strong empathy for ordinary people and display a willingness to examine family, happiness and mortality, using the rules of SF to ask fundamental questions about our lives and beliefs."
446,3.85,24754,"Nathan Glass has come to Brooklyn to die. Divorced, retired, estranged from his only daughter, the former life insurance salesman seeks only solitude and anonymity. Then Glass encounters his long-lost nephew, Tom Wood, who is working in a local bookstore—a far cry from the brilliant academic career Tom had begun when Nathan saw him last. Tom's boss is the colorful and charismatic Harry Brightman—a.k.a. Harry Dunkel—once the owner of a Chicago art gallery, whom fate has also brought to the ""ancient kingdom of Brooklyn, New York."" Through Tom and Harry, Nathan's world gradually broadens to include a new circle of acquaintances. He soon finds himself drawn into a scam involving a forged page of The Scarlet Letter, and begins to undertake his own literary venture, The Book of Human Folly, an account of ""every blunder, every pratfall, every embarrassment, every idiocy, every foible, and every inane act I have committed during my long and checkered career as a man."" The Brooklyn Follies is Paul Auster's warmest, most exuberant novel, a moving, unforgettable hymn to the glories and mysteries of ordinary human life."
489,4.05,39,
513,1.0,1,
